{
  "id": "olins-on-brand",
  "type": "book",
  "title": "Wally Olins on Brand",
  "subtitle": null,
  "authors": [
    "Wally Olins"
  ],
  "publisher": "Thames & Hudson",
  "first_published_year": 2003,
  "latest_edition": null,
  "identifiers": {
    "isbn_13": "9780500511459",
    "doi": null,
    "url": null
  },
  "topics": [
    "brand-identity",
    "brand-culture"
  ],
  "tier": "standard",
  "verification": {
    "status": "verified",
    "verified_on": "2026-08-18",
    "method": "Web check of title/author/publisher/year against publisher or library records",
    "evidence_url": "https://www.biblio.com/book/wally-olins-brand-olins-wally/d/1687420102",
    "notes": "Styled on the cover as 'Wally Olins: On B(R)and'. ISBN-13 is the 2003 hardcover; the 2004 paperback is 9780500285152."
  },
  "summary": "A founding corporate-identity practitioner's survey of branding as it spread from products to companies, nations, and culture, grounded in decades of identity consulting at Wolff Olins."
}
