{
  "id": "kapferer-new-strategic-brand-management",
  "type": "book",
  "title": "The New Strategic Brand Management",
  "subtitle": "Advanced Insights and Strategic Thinking",
  "authors": [
    "Jean-Noël Kapferer"
  ],
  "publisher": "Kogan Page",
  "first_published_year": 2004,
  "latest_edition": "5th edition (Kogan Page, 2012)",
  "identifiers": {
    "isbn_13": "9780749465155",
    "doi": null,
    "url": null
  },
  "topics": [
    "brand-strategy",
    "brand-management",
    "brand-identity"
  ],
  "tier": "canonical",
  "verification": {
    "status": "verified",
    "verified_on": "2026-08-18",
    "method": "Web check of title/author/publisher/year against publisher or library records",
    "evidence_url": "https://www.koganpage.com/marketing-communications/the-new-strategic-brand-management-9780749465155",
    "notes": "The 'New' title first appeared in 2004 as the 3rd edition of Kapferer's 'Strategic Brand Management' (first published 1992). ISBN-13 is the 5th edition (2012), cross-checked via booksrun.com and scirp.org reference records."
  },
  "summary": "The leading European treatment of brand strategy, home of the Brand Identity Prism (physique, personality, culture, relationship, reflection, self-image) and rigorous work on brand architecture and extensions."
}
