{
  "id": "wheeler-designing-brand-identity",
  "type": "book",
  "title": "Designing Brand Identity",
  "subtitle": "A Comprehensive Guide to the World of Brands and Branding",
  "authors": [
    "Alina Wheeler",
    "Rob Meyerson"
  ],
  "publisher": "John Wiley & Sons",
  "first_published_year": 2003,
  "latest_edition": "6th edition (Wiley, 2024), revised by Rob Meyerson",
  "identifiers": {
    "isbn_13": "9781119984818",
    "doi": null,
    "url": null
  },
  "topics": [
    "brand-identity",
    "design-process"
  ],
  "tier": "standard",
  "verification": {
    "status": "verified",
    "verified_on": "2026-08-18",
    "method": "Web check of title/author/publisher/year against publisher or library records",
    "evidence_url": "https://www.wiley.com/en-us/Designing+Brand+Identity:+A+Comprehensive+Guide+to+the+World+of+Brands+and+Branding,+6th+Edition-p-9781119984825",
    "notes": "First edition (Wiley, 2003, ISBN 9780471213260) was by Wheeler alone under a slightly different subtitle. ISBN-13 is the 6th-edition hardcover (2024); the Wiley URL is the e-book listing."
  },
  "summary": "The standard practitioner handbook for identity programs: a five-phase process (research, strategy, design, touchpoints, asset management) illustrated with a large case library."
}
