{
  "id": "aaker-managing-brand-equity",
  "type": "book",
  "title": "Managing Brand Equity",
  "subtitle": "Capitalizing on the Value of a Brand Name",
  "authors": [
    "David A. Aaker"
  ],
  "publisher": "The Free Press",
  "first_published_year": 1991,
  "latest_edition": null,
  "identifiers": {
    "isbn_13": "9780029001011",
    "doi": null,
    "url": null
  },
  "topics": [
    "brand-equity",
    "brand-management"
  ],
  "tier": "canonical",
  "verification": {
    "status": "verified",
    "verified_on": "2026-08-18",
    "method": "Web check of title/author/publisher/year against publisher or library records",
    "evidence_url": "https://www.biblio.com/book/managing-brand-equity-aaker-david/d/1424734219",
    "notes": "ISBN-13 is the original 1991 Free Press hardcover; also confirmed via Open Library and Internet Archive records."
  },
  "summary": "The book that established brand equity as a manageable asset, defining its five components (loyalty, awareness, perceived quality, associations, proprietary assets) and how each creates value."
}
