{
  "id": "aaker-building-strong-brands",
  "type": "book",
  "title": "Building Strong Brands",
  "subtitle": null,
  "authors": [
    "David A. Aaker"
  ],
  "publisher": "The Free Press",
  "first_published_year": 1996,
  "latest_edition": null,
  "identifiers": {
    "isbn_13": "9780029001516",
    "doi": null,
    "url": null
  },
  "topics": [
    "brand-equity",
    "brand-strategy",
    "brand-identity"
  ],
  "tier": "canonical",
  "verification": {
    "status": "verified",
    "verified_on": "2026-08-18",
    "method": "Web check of title/author/publisher/year against publisher or library records",
    "evidence_url": "https://www.simonandschuster.com/books/Building-Strong-Brands/David-A-Aaker/9780029001516",
    "notes": "ISBN-13 is the 1996 Free Press hardcover, confirmed on the Simon & Schuster (current rights holder) publisher page; a later paperback carries 9780743232135."
  },
  "summary": "Introduces the Brand Identity Planning model and the brand-as-product/organization/person/symbol framework; the standard reference for constructing a brand identity system beyond a positioning statement."
}
