{
  "id": "miller-building-a-storybrand",
  "type": "book",
  "title": "Building a StoryBrand",
  "subtitle": "Clarify Your Message So Customers Will Listen",
  "authors": [
    "Donald Miller"
  ],
  "publisher": "HarperCollins Leadership",
  "first_published_year": 2017,
  "latest_edition": null,
  "identifiers": {
    "isbn_13": "9780718033323",
    "doi": null,
    "url": null
  },
  "topics": [
    "brand-storytelling"
  ],
  "tier": "supplementary",
  "verification": {
    "status": "verified",
    "verified_on": "2026-08-18",
    "method": "Web check of title/author/publisher/year against publisher or library records",
    "evidence_url": "https://www.abebooks.com/9780718033323/Building-StoryBrand-Clarify-Message-Customers-0718033329/plp",
    "notes": "Published October 2017; the 0-7180 ISBN prefix belongs to Thomas Nelson, the HarperCollins division under which the HarperCollins Leadership imprint operates. A reported 'StoryBrand 2.0' successor edition (2025) was not verified in this pass."
  },
  "summary": "The SB7 messaging framework: the customer as hero and the brand as guide, applied as a seven-part story structure for websites, campaigns, and sales copy."
}
