{
  "id": "ries-trout-positioning",
  "type": "book",
  "title": "Positioning",
  "subtitle": "The Battle for Your Mind",
  "authors": [
    "Al Ries",
    "Jack Trout"
  ],
  "publisher": "McGraw-Hill",
  "first_published_year": 1981,
  "latest_edition": "20th Anniversary Edition (McGraw-Hill, 2001)",
  "identifiers": {
    "isbn_13": "9780070652637",
    "doi": null,
    "url": null
  },
  "topics": [
    "positioning",
    "consumer-behavior"
  ],
  "tier": "canonical",
  "verification": {
    "status": "verified",
    "verified_on": "2026-08-18",
    "method": "Web check of title/author/publisher/year against publisher or library records",
    "evidence_url": "https://search.worldcat.org/title/Positioning-:-the-battle-for-your-mind/oclc/6487734",
    "notes": "ISBN-13 is the 1981 McGraw-Hill hardcover first edition (WorldCat and AbeBooks). The 20th Anniversary Edition (2001) is 9780071373586."
  },
  "summary": "The origin of positioning theory: brands compete for a slot in the prospect's mind, and strategy consists of owning a word or position against the category leader."
}
